{
  "$schema": "https://promptstudio.dev/schemas/v2.0/prompt.schema.json",
  "title": "test prompt",
  "models": [
    "gpt-4-turbo",
    "claude-3-sonnet"
  ],
  "prompt": {
    "persona": {
      "role": "You are a helpful AI assistant."
    },
    "instructions": [
      "Please help with the following task."
    ],
    "few_shot_examples": [
      {
        "input": "Example input",
        "output": "Example output",
        "explanation": "This shows how to handle this type of input"
      }
    ]
  },
  "user_input_template": "{{user_query}}",
  "variables": [
    {
      "name": "user_query",
      "type": "string",
      "description": "The user's query or request",
      "required": true
    }
  ],
  "test_cases": [
    {
      "name": "Basic Test",
      "inputs": {
        "user_query": "Hello, how are you?"
      }
    }
  ],
  "metadata": {
    "author": "Prompt Studio User",
    "created": "2025-06-17T14:29:58.332Z",
    "version": "1.0.0",
    "category": "other",
    "difficulty": "beginner"
  }
}