{
  "$schema": "../schemas/prompt.schema.json",
  "title": "Simple Assistant Test",
  "description": "A basic test prompt to verify the extension is working",
  "models": ["gpt-4-turbo"],
  "prompt": {
    "persona": {
      "role": "You are a helpful and friendly AI assistant.",
      "tone": "Professional but approachable"
    },
    "instructions": [
      "Answer the user's question clearly and concisely",
      "Be helpful and provide accurate information",
      "Keep your response focused and relevant"
    ]
  },
  "user_input_template": "{{user_question}}",
  "variables": [
    {
      "name": "user_question",
      "type": "string",
      "description": "The question or request from the user",
      "required": true
    }
  ],
  "test_cases": [
    {
      "name": "Basic Greeting",
      "description": "Test basic conversational response",
      "inputs": {
        "user_question": "Hello! How are you today?"
      }
    },
    {
      "name": "Information Request",
      "description": "Test information retrieval capability",
      "inputs": {
        "user_question": "What is the capital of France?"
      }
    },
    {
      "name": "Explanation Request",
      "description": "Test ability to explain concepts",
      "inputs": {
        "user_question": "Can you explain what machine learning is in simple terms?"
      }
    }
  ],
  "metadata": {
    "author": "Prompt Studio",
    "created": "2024-01-15T10:00:00Z",
    "version": "1.0.0",
    "category": "other",
    "difficulty": "beginner",
    "tags": ["test", "basic", "assistant"]
  }
} 